{"schema_version":"cognitive-runtime.personal-model/v2","claim_id":"pm-synthetic-feedback-pattern","record_type":"personal_model","scope":{"contexts":["high_uncertainty_decision"],"conditions":["long_feedback_delay"]},"epistemic":"user_confirmed_hypothesis","confidence":"medium","source_refs":["src-synthetic-a","src-synthetic-b"],"counterevidence_refs":["src-synthetic-c"],"competing_explanations":["temporary_fatigue"],"revision_triggers":["repeated_counterexample"],"supersedes":[],"created_at":"2026-08-11","updated_at":"2026-08-11"}
